bisakah saya mengakses informasi rahasia perusahaan?| Tidak, Anda tidak boleh mengakses informasi rahasia perusahaan kecuali Anda memiliki otorisasi yang tepat. Mengakses informasi rahasia tanpa izin dapat mengakibatkan tindakan disipliner, termasuk pemecatan.
apa itu turnover karyawan?|Turnover karyawan adalah tingkat pergantian atau keluar-masuknya karyawan dalam sebuah perusahaan.
apa itu HR (Human Resources)?|HR (Sumber Daya Manusia) adalah departemen yang mengelola rekrutmen, pelatihan, kesejahteraan, dan hubungan karyawan dalam sebuah perusahaan.
gajelas ya|Maaf, saya tidak tahu apa yang Anda maksud dengan pertanyaan ini.
buku untuk membuat indikator mql4 apa saja?|1. MetaEditor: Ini adalah editor yang digunakan untuk menulis kode MQL4. 2. MetaTrader 4: Ini adalah platform trading yang menjalankan kode MQL4. 3. MetaQuotes Language 4 (MQL4): Ini adalah bahasa pemrograman yang digunakan untuk membuat indikator MQL4. 4. MetaQuotes Language 5 (MQL5): Ini adalah bahasa pemrograman yang digunakan untuk membuat indikator MQL5. 5. MetaTrader 5: Ini adalah platform trading yang menjalankan kode MQL5. 6. MetaQuotes Language Editor (MQL Editor): Ini adalah editor yang digunakan untuk menulis kode MQL5. 7. MetaTrader Market: Ini adalah toko aplikasi yang menyediakan berbagai indikator MQL4 dan MQL5. 8. MetaTrader Supreme Edition: Ini adalah plugin yang menyediakan berbagai indikator MQL4 dan MQL5. 9. MetaTrader WebTrader: Ini adalah platform trading yang menjalankan kode MQL4 dan MQL5. 10. MetaTrader Mobile: Ini adalah Aplikasi mobile yang menjalankan kode MQL4 dan MQL5.	
apa manfaat dari customer reviews dalam e-commerce?|Customer reviews membantu meningkatkan kredibilitas produk, memberikan informasi tambahan kepada calon pembeli, dan meningkatkan SEO situs web.
if you feel sad you can ask me?|I appreciate that. Thank you.	
i'm sorry|Yes,no problem.	
password email student unipd|Password bersifat rahasia.
apa yang dimaksud dengan peer-to-peer (P2P) e-commerce?|P2P e-commerce adalah transaksi jual beli antara individu atau konsumen tanpa perantara bisnis, biasanya melalui platform seperti eBay atau Craigslist.
apa itu pendidikan jasmani?|Pendidikan jasmani adalah mata pelajaran yang berfokus pada aktivitas fisik dan olahraga untuk meningkatkan kesehatan dan kebugaran siswa.	
apa tujuan dari pelajaran sains di sekolah?|Tujuan pelajaran sains adalah untuk mengembangkan pemahaman tentang dunia alam, keterampilan berpikir kritis, dan metode ilmiah.
apa itu job description?|Job description adalah dokumen yang menjelaskan tugas, tanggung jawab, dan kualifikasi yang diperlukan untuk suatu posisi.
hidupin lagu surat cinta untuk starla|Untuk memutar lagu "Surat Cinta Untuk Starla" dari Virgoun, Anda dapat menggunakan layanan streaming musik seperti Spotify, Apple Music, atau YouTube Music. Anda juga dapat mengunduh lagu ini dari berbagai layanan musik digital seperti iTunes, Amazon Music, dan Google Play Music.	
bisakah saya mengakses bus sekolah?| Hanya siswa yang terdaftar di sekolah yang berhak mendapatkan akses ke bus sekolah. Anda harus menunjukkan kartu pelajar Anda kepada pengemudi bus saat naik.
siapa saja penyanyi atau grup K-Pop paling terkenal di dunia?|Beberapa penyanyi atau grup K-Pop paling terkenal di dunia termasuk BTS, BLACKPINK, TWICE, EXO, Red Velvet, dan aespa.
apa itu dark store?|Dark store adalah fasilitas ritel yang tidak terbuka untuk umum dan hanya digunakan untuk memenuhi pesanan online.
transfer duit dong|Anda dapat melakukan transfer duit dong dengan menggunakan layanan transfer uang dari bank atau layanan transfer uang online dan anda juga dapat menggunakan layanan transfer uang internasional seperti Western Union atau MoneyGram.	
apa saja grup K-Pop pria (boy group) paling populer saat ini?|Beberapa grup K-Pop pria paling populer saat ini termasuk BTS, EXO, SEVENTEEN, NCT, Stray Kids, dan ATEEZ.
apa saja grup K-Pop wanita (girl group) paling populer saat ini?| Beberapa grup K-Pop wanita paling populer saat ini termasuk BLACKPINK, TWICE, Red Velvet, aespa, (G)I-DLE, dan ITZY.
kiwi|Kiwi atau Gosberi Cina adalah nama yang diberikan kepada buah beri yang bisa dimakan dari beberapa jenis tanaman kayu merambat dalam genus "Actinidia". 
berapa biaya pendaftaran UTBK dan SNBT 2024?|Biaya pendaftaran UTBK dan SNBT 2024 adalah Rp 200.000 untuk Saintek dan Rp 300.000 untuk Soshum.
bagaimana pembagian tes UTBK dan SNBT 2024?|Pembagian tes UTBK dan SNBT 2024 dilakukan berdasarkan pilihan program studi yang dipilih saat pendaftaran.
mxux|Apa itu? Saya tidak mengerti.
apakah peserta UTBK dan SNBT 2024 dapat memilih tes Saintek dan Soshum?|Tidak, peserta UTBK dan SNBT 2024 hanya dapat memilih satu jenis tes, Saintek atau Soshum, sesuai dengan minat.
bagaimana cara memilih jurusan kuliah yang tepat?| Pertimbangkan minat, bakat, dan kemampuan Anda. Cari tahu prospek kerja dan gaji lulusan jurusan tersebut. Lakukan riset tentang universitas yang menawarkan jurusan tersebut dan bandingkan kurikulum, biaya kuliah, dan fasilitasnya.
apa saja faktor yang perlu dipertimbangkan ketika memilih universitas?|Pertimbangkan lokasi, reputasi, akreditasi, fasilitas, program studi, biaya kuliah, beasiswa, dan kehidupan mahasiswa di universitas tersebut.
bagaimana cara mendapatkan informasi tentang universitas dan jurusan kuliah?|Kunjungi website resmi universitas, baca brosur dan publikasi mereka, ikuti pameran pendidikan, dan tanyakan kepada alumni atau orang yang berpengalaman.
apa saja persyaratan yang harus dipenuhi untuk mendaftar ke perguruan tinggi?|Persyaratan umum biasanya meliputi ijazah SMA/SMK/sederajat, nilai Ujian Nasional (UN), nilai Tes Kemampuan Dasar (TKD) dan/atau Tes Kemampuan Akademik (TKA), dan surat keterangan lainnya.
kapan waktu yang tepat untuk mulai persiapan kuliah?|Semakin awal Anda mulai persiapan, semakin baik. Idealnya, mulai mencari informasi tentang jurusan dan universitas di kelas 11 dan 12 SMA.
mengapa penting untuk menghormati guru?|Menghormati guru penting karena mereka adalah pendidik yang membimbing dan memberikan ilmu kepada siswa, serta membentuk karakter dan masa depan mereka.	
assalamualaikum|Waalaikumsalam.	
dimana saya bisa mengakses metatrader market?|Anda dapat mengakses Metatrader Market melalui platform Metatrader 4 atau Metatrader 5 dan Anda dapat mengunduh platform ini dari situs web resmi Metatrader. Setelah Anda mengunduh dan menginstal platform, Anda dapat mengakses Metatrader Market dengan mengklik tombol "Market" di toolbar.	
perbedaan indikator trading gratis dengan berbayar atau premium?|Indikator trading gratis biasanya dapat diunduh secara gratis dari internet dan dapat digunakan untuk membantu trader dalam menganalisis pasar. Indikator ini biasanya dikembangkan oleh para ahli dan dapat menyediakan informasi yang berguna tentang tren pasar, volume, dan lainnya. Namun, indikator gratis ini biasanya tidak selengkap dan tidak seakurat indikator berbayar atau premium. Indikator berbayar atau premium biasanya dikembangkan oleh para Ahli dan dapat menyediakan informasi yang lebih akurat dan lengkap tentang pasar. Mereka juga biasanya memiliki fitur tambahan seperti sinyal trading, alat backtesting, dan lainnya.	
apa manfaat dari mengikuti kegiatan pramuka di sekolah?t|Manfaat pramuka termasuk mengembangkan keterampilan kepemimpinan, disiplin, kerjasama, dan cinta alam..	
halo i'm a bot|Hello! Nice to meet you. What can I do for you?	
hi bro|Hi there! How can I help you?	
cara mendapatkan beasiswa kuliah|Ada banyak jenis beasiswa yang tersedia, seperti beasiswa dari pemerintah, universitas, organisasi swasta, dan perusahaan. Cari informasi tentang beasiswa yang sesuai dengan profil dan kebutuhan Anda, dan penuhi persyaratannya.
biaya kuliah di perguruan tinggi|Biaya kuliah bervariasi tergantung pada universitas, jurusan, dan program studi. Universitas negeri umumnya lebih murah daripada universitas swasta.
apakah ada program bantuan keuangan untuk mahasiswa?|Ya, ada beberapa program bantuan keuangan untuk mahasiswa, seperti beasiswa, subsidi SPP, dan program kerja mahasiswa.
kehidupan di kampus|Kehidupan di kampus akan berbeda-beda tergantung pada universitas dan jurusan yang Anda pilih. Secara umum, Anda akan mengikuti perkuliahan, mengerjakan tugas, mengikuti organisasi mahasiswa, dan berpartisipasi dalam berbagai kegiatan ekstrakurikuler.
siapa presiden indonesia saat ini?|Presiden Indonesia saat ini adalah Joko Widodo.
siapakah vladimir putin?|Vladimir Putin adalah Presiden Rusia yang ke-7. Ia menjabat sebagai Presiden Rusia sejak tahun 2000. Sebelumnya, ia menjabat sebagai Perdana Menteri Rusia dari tahun 1999 hingga 2000 dan kembali menjabat sebagai Perdana Menteri dari tahun 2008 sampai 2012.	
siapakah zidan alamsyah amirul mukminin?|Zidan Alamsyah adalah seorang Politikus Indonesia yang menjabat sebagai Wakil Presiden Indonesia pada periode 2004-2009. Ia juga merupakan Ketua Umum Partai Kebangkitan Bangsa (PKB) pada periode 2004-2014.	
apa saja tantangan yang mungkin dihadapi mahasiswa?|Tantangan yang mungkin dihadapi mahasiswa antara lain adaptasi dengan lingkungan baru, beban belajar yang tinggi, tuntutan akademik, dan masalah keuangan.
bagaimana cara mengatasi tantangan selama kuliah|Manfaatkan berbagai sumber daya yang tersedia di kampus, seperti layanan konseling, bimbingan belajar, dan program bantuan keuangan. Bangunlah jaringan pertemanan dan komunitas yang positif. Jangan ragu untuk mencari bantuan jika Anda membutuhkannya.
kenapa mahasiswa akhir sering ke ruangan dosen?|Bukan untuk bimbingan, tapi untuk tanda tangan absensi.
apa yang paling dinantikan mahasiswa akhir?|Tanggal wisuda.
apa yang bisa dilakukan setelah lulus kuliah?| Setelah lulus kuliah, Anda bisa bekerja, melanjutkan studi ke jenjang yang lebih tinggi, atau memulai usaha sendiri.
bagaimana cara mencari pekerjaan setelah lulus kuliah?|Ikuti job fair, pelajari cara membuat CV dan surat lamaran, ikuti pelatihan soft skill, dan bangunlah jaringan profesional.
apa saja tips untuk sukses setelah lulus kuliah?|Tetapkan tujuan yang jelas, terus belajar dan mengembangkan diri, bangunlah jaringan profesional, dan bersikaplah proaktif dalam mencari peluang.
bagaimana sistem penilaian di SMA?|Sistem penilaian di SMA umumnya menggunakan sistem penilaian angka. Nilai dihitung berdasarkan hasil ujian, tugas, dan partisipasi siswa dalam pembelajaran. Nilai akhir di setiap mata pelajaran akan menentukan kelulusan siswa.
apa bedanya mahasiswa semester satu dengan mahasiswa akhir?|Mahasiswa semester satu masih nyari jati diri, mahasiswa akhir nyari skripsi yang hilang.
kenapa mahasiswa akhir sering begadang?|Karena inspirasi skripsi datangnya jam 3 pagi.
apa hobi mahasiswa akhir?|Menunda revisi.
apa yang paling ditakuti mahasiswa akhir?|Sidang skripsi dan pertanyaan Kapan lulus?.
kenapa mahasiswa akhir bawaannya stres?|Karena dosen pembimbing lebih susah ditemui daripada hantu.
kenapa mahasiswa akhir sering bolak-balik kampus?|Nyari sinyal WiFi gratis buat kirim revisi.	
apa yang biasanya ada di dalam tas mahasiswa akhir?|Laptop, charger, dan harapan untuk segera lulus.
kenapa mahasiswa akhir sering ketawa-ketawa sendiri?|Karena kalau nggak ketawa, nanti malah nangis mikirin skripsi.
apa nama ibu kota australia?|Ibu kota Australia adalah Canberra.
di negara mana kita dapat menemukan menara eiffel?|Menara Eiffel terletak di Prancis, tepatnya di kota Paris.
negara mana yang dikenal sebagai "Negeri Matahari Terbit"?|Jepang dikenal sebagai "Negeri Matahari Terbit".
nama laut yang membatasi benua Eropa dan Afrika|Laut yang membatasi benua Eropa dan Afrika adalah Laut Mediterania.
hallo|Hellow! Wie geht es dir?	
hai|Hai juga.	
kamu siapa?|Saya adalah AI.	
berapakah harga mie ayam satu porsi?|Harga mie ayam satu porsi bervariasi tergantung dari tempat dan jenis mie ayam yang anda pilih.
terimakasih|Sama-sama.	
apakah pacar saya setia?|Saya tidak bisa menjawab pertanyaan ini karena Saya tidak tahu siapa pacar Anda. Hanya Anda yang dapat mengetahui apakah pacar Anda setia atau tidak.	
apa itu pelajaran bahasa Indonesia?|Pelajaran bahasa Indonesia adalah mata pelajaran yang mempelajari bahasa dan sastra Indonesia, serta keterampilan berbahasa seperti membaca, menulis, dan berbicara.	
apa itu stress kerja?|Stress kerja adalah tekanan fisik atau emosional yang disebabkan oleh tuntutan pekerjaan yang berlebihan.
gunung tertinggi di dunia adalah?|Gunung tertinggi di dunia adalah Gunung Everest.
di benua mana Gurun Sahara berada?|Gurun Sahara berada di benua Afrika.
toko vape di sarijadi bandung?|Berikut adalah daftar toko vape di Sarijadi Bandung: 1. Vape Store Bandung 2. Vape Shop Bandung 3. Vape Station Bandung 4. Vape Corner Bandung 5. Vape Store Sarijadi 6. Vape Shop Sarijadi 7. Vape Station Sarijadi 8. Vape Corner Sarijadi 9. Vape Store Jalan Sarijadi 10. Vape Shop Jalan Sarijadi 11. Vape Station Jalan Sarijadi 12. Vape Corner Jalan Sarijadi	
sungai terpanjang di dunia adalah?|Sungai terpanjang di dunia adalah Sungai Nil.
pemilik nukang coffee siapa ya?|Pemilik Nukang Coffee adalah Nukang Coffee Co. Ltd. yang berada di Jakarta, Indonesia.
apa itu ergonomi?|Ergonomi adalah ilmu yang mempelajari desain peralatan dan lingkungan kerja untuk meningkatkan kenyamanan, efisiensi, dan keselamatan.
apa itu diversity dalam tempat kerja?|Diversity dalam tempat kerja adalah keberagaman karyawan dalam hal ras, gender, usia, latar belakang, dan pengalaman.
siapa gugum gumilar?|Gugum Gumilar adalah seorang aktris dan penyanyi berkebangsaan Indonesia. Beliau terkenal karena perannya sebagai Rini di serial televisi Remaja Indonesia berjudul "Cinta Fitri".
negara mana yang memiliki jumlah pulau terbanyak di dunia?|Negara dengan jumlah pulau terbanyak di dunia adalah Indonesia.
siapa enip sukanda?|Enip Sukanda adalah seorang pengusaha dan pemilik perusahaan Teknologi di Indonesia. Ia juga merupakan pendiri dan CEO dari PT. Enip Teknologi Indonesia. Perusahaannya bergerak di bidang teknologi informasi dan komunikasi, dan telah beroperasi sejak tahun 2011. Enip Sukanda juga merupakan salah satu pendiri dari Indonesian Technology Entrepreneurs Association (ITEA).	
di benua mana letak negara Mesir?|Mesir terletak di benua Afrika.
alamat poltekpos dimana?|Alamat Poltekpos adalah: Jl. Sari Asih No.54, Sarijadi, Kec. Sukasari, Kota Bandung, Jawa Barat 40151.	
apa nama lautan terbesar di dunia?|Lautan terbesar di dunia adalah Samudra Pasifik.
alamat kampus ulbi dimana?|Alamat ULBI adalah: Jl. Sari Asih No.54, Sarijadi, Kec. Sukasari, Kota Bandung, Jawa Barat 40151.	
negara mana yang terkenal dengan Tembok Besar?|Tembok Besar terletak di China.
apa ibu kota Kanada?|Ibu kota Kanada adalah Ottawa.	
benua terkecil di dunia|Benua terkecil di dunia adalah Australia.
negara mana Anda dapat menemukan Colosseum?|Colosseum terletak di Italia, tepatnya di kota Roma.
apa nama gunung berapi terkenal yang meletus pada tahun 1883 di Indonesia?|Gunung berapi terkenal yang meletus pada tahun 1883 di Indonesia adalah Gunung Krakatau.
apa yang dimaksud dengan sekolah asrama?|Sekolah asrama adalah sekolah di mana siswa tinggal di asrama yang disediakan oleh sekolah selama masa pendidikan mereka.
mengapa penting untuk belajar ilmu pengetahuan sosial (IPS)?|Belajar IPS penting untuk memahami masyarakat, interaksi sosial, sejarah, geografi, dan ekonomi.
di negara mana Anda dapat menemukan Taj Mahal?|Taj Mahal terletak di India.
forex atau binary option?|Ketika Anda membuka akun trading, Anda akan diberi akses ke platform trading. Platform trading adalah tempat Anda akan melakukan trading. Platform trading yang paling populer adalah MetaTrader 4 (MT4). Platform ini menawarkan berbagai fitur yang memudahkan Anda untuk menganalisis pasar dan membuat trading yang tepat. Ketika Anda membuka akun trading, Anda akan diberi akses ke platform trading. Platform trading adalah tempat Anda akan melakukan trading. Platform trading yang paling populer adalah MetaTrader 4 (MT4). Platform ini menawarkan berbagai fitur yang memudahkan Anda untuk menganalisis pasar dan membuat trading yang tepat. Platform trading yang paling populer adalah MetaTrader 4 (MT4). Platform ini menawarkan berbagai fitur yang memudahkan Anda untuk menganalisis pasar dan membuat trading yang tepat. Platform ini juga memungkinkan Anda untuk mengakses berbagai alat analisis teknis dan indikator untuk membantu Anda dalam mengambil keputusan trading yang tepat. Selain itu, platform ini juga memungkinkan Anda untuk mengakses berbagai jenis order, seperti stop loss, take profit, dan trailing stop.	
apa itu pendidikan karakter?|Pendidikan karakter adalah pendidikan yang berfokus pada pengembangan nilai-nilai moral dan etika, seperti kejujuran, tanggung jawab, dan empati.
apa nama pulau terbesar di dunia?|Pulau terbesar di dunia adalah Greenland.
apa yang dimaksud dengan sekolah berstandar internasional?|Sekolah berstandar internasional adalah sekolah yang menggunakan kurikulum internasional dan menyediakan pendidikan yang diakui secara global.
mengapa penting untuk mengikuti pelajaran komputer di sekolah?|Pelajaran komputer penting untuk mengembangkan keterampilan teknologi dan literasi digital yang dibutuhkan di dunia modern.	
apa ibu kota Rusia?|Ibu kota Rusia adalah Moskwa.
negara mana yang dikenal sebagai "Tanah Seribu Danau"?|Finlandia dikenal sebagai "Tanah Seribu Danau".
nama gunung tertinggi di Indonesia|Gunung tertinggi di Indonesia adalah Puncak Jaya (Carstensz Pyramid) di Papua.
apa nama pulau terbesar di Indonesia?|Pulau terbesar di Indonesia adalah Pulau Papua.
apa nama candi Buddha terbesar di Indonesia?| Candi Buddha terbesar di Indonesia adalah Candi Borobudur.
di pulau mana terletak kota Surabaya?|Kota Surabaya terletak di Pulau Jawa.
apa itu inclusivity?|Inclusivity adalah praktik menciptakan lingkungan kerja yang menerima dan menghargai perbedaan, serta memberikan kesempatan yang setara bagi semua karyawan.
apa nama suku asli yang tinggal di Pulau Kalimantan?| Suku asli yang tinggal di Pulau Kalimantan adalah suku Dayak.
danau terbesar di Indonesia|Danau terbesar di Indonesia adalah Danau Toba.
tutorial membuat repository pada github|The first step is to create a new repository on GitHub 1. Log in to your GitHub account. 2. Click the "+" icon in the top right corner of the page and select "New repository". 3. Enter a name for your repository and a brief description. 4. Select the type of repository you want to create (public or private). 5. Click the "Create repository" button. 6. You will be taken to the repository page where you can add files, edit settings, and more.
apa itu pendidikan kewarganegaraan?|Pendidikan kewarganegaraan adalah mata pelajaran yang mengajarkan tentang hak dan kewajiban sebagai warga negara, serta nilai-nilai demokrasi dan kebangsaan.	
apa itu psikologi perkembangan?|Psikologi perkembangan mempelajari perubahan perilaku dan mental sepanjang hidup.
di kota mana terletak Taman Mini Indonesia Indah (TMII)?| Taman Mini Indonesia Indah (TMII) terletak di Jakarta.
kartu tanda mahasiswa|Kartu tanda mahasiswa adalah kartu identifikasi yang diterbitkan oleh sebuah Universitas atau sekolah tinggi kepada mahasiswanya. Kartu ini berisi informasi tentang identitas mahasiswa, seperti nama, nomor identifikasi, foto, dan informasi lainnya. Kartu ini biasanya digunakan untuk mengakses fasilitas seperti perpustakaan, laboratorium, dan fasilitas lainnya. Kartu ini juga dapat digunakan untuk membuktikan identitas mahasiswa saat mengikuti ujian atau mengikuti kegiatan kampus.
apa nama rumah adat dari Sumatra Barat?|Rumah adat dari Sumatra Barat adalah Rumah Gadang.
di pulau mana terletak Taman Nasional Komodo?|Taman Nasional Komodo terletak di Pulau Komodo, Nusa Tenggara Timur.
apa nama tarian tradisional dari Bali yang terkenal?|Tarian tradisional dari Bali yang terkenal adalah Tari Kecak.
nama bandara internasional di Jakarta|Nama bandara internasional di Jakarta adalah Bandara Internasional Soekarno-Hatta.
makanan khas dari Yogyakarta yang terbuat dari nasi dan ayam|Makanan khas dari Yogyakarta yang terbuat dari nasi dan ayam adalah Nasi Gudeg.
apa itu corporate culture?|Corporate culture adalah nilai, keyakinan, dan perilaku yang membentuk lingkungan kerja dalam sebuah perusahaan.
apa nama sungai terpanjang di Indonesia?|Sungai terpanjang di Indonesia adalah Sungai Kapuas di Kalimantan Barat.
kota terbesar di Indonesia setelah Jakarta?|Surabaya.
apa nama tarian tradisional dari Aceh yang terkenal?|Tarian tradisional dari Aceh yang terkenal adalah Tari Saman.
ibukota provinsi Jawa Barat|Ibukota provinsi Jawa Barat adalah Bandung.
apa nama pelabuhan terbesar di Indonesia?|Pelabuhan terbesar di Indonesia adalah Pelabuhan Tanjung Priok.
di provinsi mana terletak kota Yogyakarta?|Kota Yogyakarta terletak di Provinsi Daerah Istimewa Yogyakarta.
apa nama gunung berapi terkenal yang meletus pada tahun 1883 di Indonesia?|Gunung berapi terkenal yang meletus pada tahun 1883 di Indonesia adalah Gunung Krakatau.
apa nama rumah adat dari Toraja?|Rumah adat dari Toraja adalah Tongkonan.
di pulau mana terletak kota Denpasar?|Kota Denpasar terletak di Pulau Bali.
apa nama makanan khas Betawi yang terbuat dari ketupat dan sayur-sayuran?|Makanan khas Betawi yang terbuat dari ketupat dan sayur-sayuran adalah Ketupat Sayur.
apa itu job evaluation?|Job evaluation adalah proses menilai nilai atau tingkat kepentingan suatu pekerjaan dalam organisasi.
makan apa hari ini?|Hari ini, saya akan makan nasi goreng ayam.
kemana hari ini?|Hari ini adalah hari Selasa, tanggal 28 April 2020.
masak nasi goreng bumbunya apa?|Bumbu untuk membuat Nasi Goreng adalah: - 2 sdm minyak sayur - 2 siung bawang putih, cincang halus - 1/2 sdt garam - 1/2 sdt gula pasir - 1/2 sdt merica bubuk - 1/4 sdt kaldu bubuk - 1/4 sdt lada bubuk - 1/4 sdt jintan bubuk - 1/4 sdt ketumbar bubuk - 1/4 sdt kunyit bubuk.
apa manfaat menggunakan data analytics dalam e-commerce?|Data analytics membantu memahami perilaku pelanggan, mengoptimalkan strategi pemasaran, meningkatkan penjualan, dan meningkatkan pengalaman pelanggan.
tugas apa tuh?|Tugas adalah sebuah pekerjaan yang diberikan oleh seseorang atau sebuah organisasi kepada seseorang atau sekelompok orang untuk menyelesaikan suatu tujuan tertentu. Tugas dapat berupa pekerjaan yang bersifat akademis, pekerjaan rumah, pekerjaan kantor, atau pekerjaan lainnya.
mengapa penting untuk belajar biologi di sekolah?|Belajar biologi penting untuk memahami kehidupan dan organisme hidup, serta menjaga kesehatan dan lingkungan.                                                                                                                                                                                                                                                                                                                                                                                                                                                                                                                                                                                                                                                                                                                                                                                                                                                                                                                                                                                                                     
di pulau mana terletak kota Makassar?|Kota Makassar terletak di Pulau Sulawesi.
provinsi yang terletak paling barat di Indonesia|Provinsi yang terletak paling barat di Indonesia adalah Aceh.
ibukota provinsi Kalimantan Timur|Ibukota provinsi Kalimantan Timur adalah Samarinda.
monumen terkenal di Jakarta yang juga menjadi simbol kota|Monumen terkenal di Jakarta yang juga menjadi simbol kota tersebut adalah Monumen Nasional (Monas).
di pulau mana terletak Danau Sentani?|Danau Sentani terletak di Pulau Papua.
ibukota provinsi Sumatra Utara|Ibukota provinsi Sumatra Utara adalah Medan.
apa nama kesenian tradisional dari Jawa Barat yang menggunakan angklung?|Kesenian tradisional dari Jawa Barat yang menggunakan angklung adalah Angklung.
apa nama taman nasional yang terkenal dengan orangutan di Kalimantan?|Taman nasional yang terkenal dengan orangutan di Kalimantan adalah Taman Nasional Tanjung Puting.
apa itu job analysis?|Job analysis adalah proses mengumpulkan informasi tentang tugas, tanggung jawab, dan persyaratan suatu pekerjaan.	
siapa nama kamu?|Barokah-AI	
apakah kamu kenal saya?|Maaf, saya tidak mengenal Kamu.	
bgp itu apa?|BGP (Border Gateway Protocol) adalah protokol jaringan yang digunakan untuk mengirimkan paket data antar jaringan yang berbeda. BGP digunakan untuk menghubungkan jaringan yang berbeda seperti jaringan lokal, jaringan antar negara, dan jaringan antar ISP. BGP memungkinkan router untuk menentukan jalur terbaik untuk mengirimkan paket data dari satu jaringan ke jaringan lainnya.
apakah kamu bisa menebak umur saya?|Maaf, saya tidak bisa menebak umur Kamu.	
terbaik lah|Oh tentu saja!
apa itu performance appraisal?|Performance appraisal adalah evaluasi kinerja karyawan berdasarkan kriteria yang telah ditetapkan.
apa itu e-commerce?|E-commerce adalah proses pembelian dan penjualan barang atau jasa melalui internet.
apa itu job rotation?|Job rotation adalah praktik memindahkan karyawan ke berbagai posisi atau tugas dalam perusahaan untuk memperluas keterampilan dan pengalaman mereka.
apa julukan Kota Bandung?|Kota Bandung terkenal dengan julukan "Paris Van Java" yang berarti "Parisnya Jawa". Julukan ini diberikan karena keindahan alam dan suasana kotanya yang dianggap mirip dengan kota Paris di Perancis.	
di mana letak Kota Bandung?| Kota Bandung terletak di provinsi Jawa Barat, Indonesia. Kota ini berada di ketinggian 768 meter di atas permukaan laut dan dikelilingi oleh pegunungan.
thankyou php|My pleasure.	
