jd klw mw cera bimbingan utamakan diskusi dulu baru dia bs di approval prosesnya begitu jgn blm diskusi udah cetak gak bisa dia faisal|Terima kasih atas pertanyaan Anda.\n\nUntuk memastikan bahwa bimbingan yang Anda terima dapat disetujui oleh , Anda harus melakukan diskusi terlebih dahulu. Diskusi ini akan membantu Anda untuk memastikan bahwa bimbingan yang Anda terima sesuai dengan standar yang ditetapkan oleh. Setelah diskusi selesai, Anda dapat mencetak bimbingan dan mengajukannya untuk disetujui oleh . Tanpa diskusi terlebih dahulu, bimbingan Anda tidak akan dapat disetujui.
malam besok kemana|ke jonggol uhuy.
kamu tinggal di planet bumi|bukan aku di pluto.
siapa pak hanafi umry|Pak Hanafi Umry adalah seorang politisi Indonesia yang menjabat sebagai Wakil Ketua DPRD Provinsi Jawa Barat pada periode 2014-2019. Ia juga merupakan anggota Partai Kebangkitan Bangsa (PKB).
pak anto menerima royalti atas hak yg digunakan sebesar 15000000 seberapa besar pemotongan pph pasal 23 atas royalti yang di bebankan kepada pak anto,|Pemotongan PPh Pasal 23 atas royalti yang di bebankan kepada Pak Anto adalah sebesar 2.25 juta (2.25% x 15 juta).
berapa minimal tension dari strand 10m|Tension minimal untuk strand 10m adalah sekitar 0,5 kN (kilonewton)."
#6 cu itu kabel apa|Ini adalah kabel HDMI.
tembung daerah mana|gatau aku bang.
tembung daerah mana|Tembung adalah sebuah bahasa daerah yang berasal dari Jawa Tengah, Indonesia.
siapa nama bapak mu|sory gapunya bapa.
Bagaimana cara mengeksekusi kode dalam Jupyter Notebook|Untuk mengeksekusi kode dalam Jupyter Notebook, klik pada cell kode dan tekan Shift + Enter atau klik tombol Run di toolbar
cek absensi bimbingan i2|Anda dapat mengecek absensi bimbingan I2 dengan menghubungi pihak sekolah atau kantor yang menyelenggarakan bimbingan I2. Anda juga dapat menghubungi pengajar atau tutor yang mengajar di bimbingan I2 untuk meminta informasi tentang absensi.
cek absensi bimbingan i2|Anda dapat mengecek absensi bimbingan I2 dengan menghubungi pihak sekolah atau kantor yang menyelenggarakan bimbingan I2. Anda juga dapat menghubungi pengajar atau tutor yang mengajar di bimbingan I2 untuk meminta informasi tentang absensi.
minta sk dosen pengampu 20222|Kepada Yth.\n\nDosen Pengampu Mata Kuliah 20222,\n\nDengan hormat,\n\nSaya adalah mahasiswa yang mengambil mata kuliah 20222. Saya ingin bertanya tentang materi yang akan diajarkan di kelas dan juga menanyakan tentang tugas-tugas yang harus saya kerjakan.\n\nTerima kasih atas perhatiannya.\n\nHormat saya,\n\n[Nama]
perwalian|Perwalian adalah proses pengawasan dan pengelolaan pendidikan siswa di sekolah. Proses ini melibatkan orang tua, guru, dan pihak sekolah. Perwalian bertujuan untuk memastikan bahwa siswa mendapatkan pendidikan yang tepat dan berkualitas. Proses ini juga membantu siswa untuk mencapai tujuan akademik mereka.\n\nPerwalian meliputi berbagai aspek pendidikan siswa, termasuk pemilihan mata pelajaran, pemantauan kemajuan akademik, pengelolaan masalah disiplin, dan pengembangan keterampilan sosial. Proses ini juga melibatkan orang tua dalam membantu siswa mencapai tujuan akademik mereka.\n\nPerwalian juga membantu siswa untuk mengembangkan keterampilan sosial mereka. Proses ini melibatkan orang tua dan guru untuk membantu siswa mengembangkan keterampilan sosial yang diperlukan untuk berinteraksi dengan orang lain. Proses ini juga membantu siswa untuk mengembangkan keterampilan berpikir kritis dan keterampilan komunikasi yang diperlukan untuk mencapai tujuan akademik mereka.
Bagaimana cara menyimpan notebook di Jupyter|Anda dapat menyimpan notebook dengan menekan Ctrl + S atau dengan memilih opsi Save and Checkpoint dari menu File.
bandung provinsi mana sih|provinsi jawa barat.
Apa itu kernel dalam Jupyter Notebook|Kernel adalah engine yang menjalankan kode dalam Jupyter Notebook. Kernel yang paling umum digunakan adalah IPython untuk kode Python, tetapi Jupyter mendukung banyak kernel lain untuk bahasa pemrograman yang berbeda.
Bagaimana cara menambahkan cell baru di Jupyter Notebook|Anda dapat menambahkan cell baru dengan mengklik tombol Insert di toolbar dan memilih Insert Cell Above atau Insert Cell Below.
Apa kegunaan dari Markdown cell dalam Jupyter Notebook|Markdown cell digunakan untuk menulis teks naratif menggunakan sintaks markdown. Ini berguna untuk dokumentasi, penjelasan kode, dan menambahkan catatan.
minta kalender akademik 20222023|nKalender Akademik 2022/2023:\n\nSemester 1\n\nMulai: September 2022\n\nAkhir: Januari 2023\n\nSemester 2\n\nMulai: Februari 2023\n\nAkhir: Juni 2023
halo kamu lagi dimana|di dunia quantum.
minta jadwal libur  masuk 20222023|Berikut adalah jadwal libur masuk tahun 2022-2023:\n\n1. Hari Raya Idul Fitri: 14-17 Mei 2022\n\n2. Hari Raya Idul Adha: 21-24 Agustus 2022\n\n3. Hari Natal: 24-25 Desember 2022\n\n4. Tahun Baru: 31 Desember 2022 - 1 Januari 2023\n\n5. Hari Buruh: 1 Mei 2023\n\n6. Hari Raya Waisak: 8 Mei 2023\n\n7. Hari Raya Idul Fitri: 2-5 Juni 2023\n\n8. Hari Raya Idul Adha: 10-13 September 2023\n\n9. Hari Natal: 24-25 Desember 2023.
harus berfikir keras untuk memahami mu|Saya akan berusaha untuk mendengarkan dengan seksama dan bertanya jika saya tidak mengerti. Saya juga akan mencoba untuk mencari tahu lebih banyak tentang topik yang Anda bicarakan untuk membantu saya memahami lebih baik.
status khsnya belum di ambil oleh|Kamu harus menghubungi sekolah untuk mengetahui status khsnya. Sekolah akan memberi tahu Anda apakah khsnya sudah diambil atau belum.
Bagaimana cara mengubah cell menjadi Markdown cell|Anda dapat mengubah cell menjadi Markdown cell dengan memilih cell yang diinginkan, lalu menekan Esc + M atau dengan memilih "Markdown" dari dropdown menu di toolbar.
kamu punya adik|punya berujuta juta.
Apa itu PostgreSQL|PostgreSQL adalah sistem manajemen basis data relasional objek open-source yang kuat dan terkenal dengan skalabilitas dan fleksibilitasnya dalam menangani data. Ini mendukung berbagai jenis data dan operasi basis data tingkat lanjut.
leuleus yah|Yahudi adalah sebuah agama monoteistik yang berasal dari Israel. Yahudi berpusat di sekitar Tanah Suci dan mengikuti hukum Taurat, yang diturunkan oleh Tuhan melalui nabi Musa. Yahudi bertekun pada tradisi dan ritual yang telah ditetapkan oleh para pendahulunya, dan mengikuti ajaran-ajaran yang ditulis dalam Kitab Suci Yahudi, yang terdiri dari Taurat, Zabur, dan Injil. Yahudi juga mengikuti ajaran-ajaran yang ditulis dalam Talmud dan lainnya. Yahudi juga mengikuti tradisi dan ritual yang berbeda-beda di seluruh dunia, tergantung pada aliran yang mereka ikuti.
gajelas kamu woy|apasih marah marah mulu.
mampus kau|Maaf, saya tidak bermaksud menyinggung Anda.
gaboleh ngomong kasar|iya maaf aku gaakan ulangi lagi.
apa itu watir|Watir adalah sebuah alat pengujian web yang berbasis Ruby. Ini memungkinkan Anda untuk menulis skrip yang mengontrol browser web seperti Firefox, Chrome, dan Internet Explorer. Anda dapat menggunakan Watir untuk menguji aplikasi web, mengambil data dari halaman web, dan melakukan banyak tugas lainnya.
Apa itu Laragon|Laragon adalah lingkungan pengembangan yang cepat dan mudah digunakan untuk membangun aplikasi web. Ini menyediakan paket lengkap untuk menjalankan server lokal dengan dukungan untuk berbagai teknologi seperti PHP, MySQL, Apache, Nginx, dan banyak lagi.
Bagaimana cara menginstal Laragon|Untuk menginstal Laragon, Anda bisa mengunduh installer dari situs resmi Laragon, kemudian jalankan installer tersebut dan ikuti petunjuk yang diberikan. Proses instalasinya sederhana dan cepat.
kamu tinggal dimana|di kayangan.
Apa saja fitur utama Laragon|Fitur utama Laragon meliputi instalasi yang mudah, dukungan untuk berbagai teknologi web (PHP, MySQL, Apache, Nginx), pembuatan project cepat, kemampuan untuk menjalankan berbagai versi PHP, dan kemampuan untuk membuat domain virtual otomatis.
Bagaimana cara membuat project baru di Laragon|Untuk membuat project baru di Laragon, Anda cukup klik kanan pada ikon Laragon di system tray, pilih Quick app, kemudian pilih jenis project yang ingin Anda buat (misalnya, WordPress, Laravel, dll.). Laragon akan otomatis mengunduh dan mengatur project untuk Anda.
kebetulan manggill lagi kesepian nihh|Maaf, saya tidak bisa menghiburmu. Tapi jangan khawatir, pasti ada orang lain yang bisa menghiburmu. Cobalah untuk menghubungi teman-temanmu atau keluargamu. Atau, jika kamu merasa lebih nyaman, cobalah untuk menulis di jurnal atau menulis puisi untuk mengekspresikan perasaanmu.
apa makanan favoritmu|kalajengking rebus.
sepertinya masih kendala|Maaf, saya tidak tahu apa yang Anda maksud dengan masih kendala. Tolong jelaskan lebih lanjut.
akhir nya hudang oge|Hudang oge, semoga kamu selalu diberikan kebahagiaan dan kesehatan.
perwalian|Perwalian adalah proses pengawasan yang dilakukan oleh orang tua atau wali terhadap anaknya dalam mengambil keputusan. Perwalian dapat berupa pengawasan langsung atau tidak langsung. Perwalian dapat berupa pemberian nasihat, pengawasan, atau bahkan pembatasan. Perwalian dapat membantu anak untuk membuat keputusan yang tepat dan bijaksana. Perwalian juga dapat membantu anak untuk mengembangkan kemampuan berpikir dan mengambil keputusan yang tepat. Perwalian juga dapat membantu anak untuk menghindari kesalahan dan membuat keputusan yang bijaksana.
Apakah Laragon mendukung Windows dan Mac|Laragon secara resmi hanya mendukung Windows. Namun, ada alternatif serupa untuk Mac seperti MAMP atau Local by Flywheel.
Bagaimana cara mengganti versi PHP di Laragon|Untuk mengganti versi PHP di Laragon, Anda bisa mengunduh versi PHP yang Anda inginkan dari situs resmi PHP dan menambahkannya ke folder bin\php di direktori instalasi Laragon. Setelah itu, Anda bisa memilih versi PHP yang diinginkan melalui menu Laragon.
Bagaimana cara mengakses phpMyAdmin di Laragon|Untuk mengakses phpMyAdmin di Laragon, Anda cukup membuka browser dan pergi ke alamat http://localhost/phpmyadmin. Anda dapat login menggunakan username dan password default yang telah Anda atur saat instalasi.
bagi jadwal|Kami menyediakan jadwal untuk berbagai kegiatan di seluruh dunia. Anda dapat menemukan jadwal untuk acara olahraga, konser, pertunjukan teater, pameran seni, dan banyak lagi. Anda dapat mencari jadwal berdasarkan lokasi, tanggal, dan jenis acara. Anda juga dapat mencari jadwal berdasarkan nama artis atau tim olahraga. Kami juga menyediakan informasi tentang tiket, lokasi, dan informasi lainnya yang berkaitan dengan acara yang Anda cari.
tidak ada respon|Tidak ada respon dari seseorang dapat menunjukkan bahwa mereka tidak tertarik atau tidak memiliki waktu untuk menanggapi. Ini juga dapat menunjukkan bahwa mereka tidak memahami atau tidak menyadari pesan yang Anda kirimkan. Jika Anda ingin mengetahui alasan mengapa Anda tidak mendapatkan respon, Anda dapat mencoba menghubungi orang tersebut secara langsung untuk menanyakan alasannya.
sama pak saya juga tidak merespon|Maaf, saya tidak bisa membantu Anda dengan masalah ini. Anda mungkin ingin mencari bantuan dari seseorang yang lebih ahli dalam bidang ini.
saya sudah cek absensi nya pak tetapi blm masuk absen yg terbaru mungkin sedang eror pak|Maaf atas ketidaknyamanan ini. Saya akan segera memeriksa dan memperbaiki masalah ini. Jika masalah ini masih berlanjut, silakan hubungi saya dan saya akan melakukan yang terbaik untuk membantu Anda. Terima kasih.
sayang|Aku juga sayang kamu.
Apakah Laragon mendukung Node.js|Ya, Laragon mendukung Node.js. Anda bisa menginstal Node.js melalui Laragon dan menggunakannya untuk menjalankan aplikasi Node.js di lingkungan pengembangan lokal Anda.
jangan ngetik love you|Tolong jangan ngetik Love You.
Bagaimana cara menambahkan ekstensi PHP di Laragon|Untuk menambahkan ekstensi PHP di Laragon, Anda bisa mengunduh ekstensi yang diinginkan dari situs resmi PHP, kemudian menyalinnya ke folder ext di direktori instalasi PHP Anda. Setelah itu, aktifkan ekstensi tersebut di file php.ini.
wswb ok sy msh rapat blm direview dan lagi eror|Maaf, saya tidak dapat membantu Anda dengan masalah ini. Anda harus menghubungi pihak yang bertanggung jawab untuk memeriksa dan meninjau rapat Anda. Jika Anda masih mengalami masalah, silakan hubungi tim dukungan teknis untuk mendapatkan bantuan lebih lanjut.
Apa kelebihan menggunakan Laragon dibandingkan dengan XAMPP atau WAMP|Kelebihan Laragon dibandingkan dengan XAMPP atau WAMP antara lain adalah instalasi yang lebih cepat dan mudah, dukungan untuk banyak teknologi, kemampuan untuk mengatur project dengan cepat, performa yang lebih baik, serta fitur tambahan seperti pembuatan domain virtual otomatis dan dukungan untuk berbagai versi PHP.
gabisa matematika|ya belajar lah.
pandung dosen|Beri hormat dan salam saat bertemu dengan dosen.\n\n2. Berpakaian rapi dan sopan saat bertemu dengan dosen.\n\n3. Berbicara dengan sopan dan bahasa yang baik saat bertemu dengan dosen.\n\n4. Jangan mengganggu dosen saat sedang mengajar.\n\n5. Jangan mengganggu dosen saat sedang berdiskusi dengan mahasiswa lain.\n\n6. Jangan mengganggu dosen saat sedang mengerjakan tugasnya.\n\n7. Jangan mengganggu dosen saat sedang berbicara dengan orang lain.\n\n8. Jangan mengganggu dosen saat sedang berpikir.\n\n9. Jangan mengganggu dosen saat sedang mengerjakan tugasnya.\n\n10. Jangan mengganggu dosen saat sedang berbicara dengan orang lain.
Apa itu Blade di Laravel|Blade adalah template engine yang disertakan dengan Laravel, yang memungkinkan Anda menggunakan logika pemrograman seperti loops dan conditional statements dalam tampilan HTML.
Bagaimana cara menampilkan variabel di Blade|Anda dapat menampilkan variabel di Blade dengan menggunakan notasi kurung kurawal ganda seperti ini: {{ $variableName }}.
Bagaimana cara menulis komentar di Blade|Untuk menulis komentar di Blade, gunakan sintaks {{-- Ini adalah komentar --}}. Komentar ini tidak akan muncul di HTML yang dihasilkan.
Apa fungsi dari directive @yield di Blade|Directive @yield digunakan untuk menentukan bagian yang dapat diisi oleh konten lain di dalam template Blade. Biasanya digunakan dalam layout untuk menentukan tempat di mana konten halaman akan ditampilkan.
Bagaimana cara meng-extend layout di Blade|Untuk meng-extend layout, gunakan directive @extends('namaLayout') di bagian atas file Blade Anda. Ini memungkinkan Anda menggunakan layout sebagai template dasar
mendung nih|apa itu mendung aku gatau.
Apa perbedaan antara @include dan @extends di Blade|include menyertakan tampilan Blade lain ke dalam tampilan saat ini, sementara @extends digunakan untuk mewarisi layout dari template dasar.
Apa itu Next.js|Next.js adalah framework React yang memungkinkan pengembangan aplikasi web dengan rendering sisi server (SSR) dan fitur-fitur seperti static site generation (SSG), routing otomatis, dan API routes.
Apa perbedaan antara SSR dan SSG di Next.js|SSR (Server-Side Rendering) merender halaman pada waktu permintaan, sehingga setiap permintaan mendapatkan versi terbaru dari halaman. SSG (Static Site Generation) merender halaman saat build time dan menghasilkan HTML statis yang sangat cepat diakses oleh pengguna.
Bagaimana cara membuat halaman baru di Next.js|Untuk membuat halaman baru di Next.js, cukup tambahkan file JavaScript atau TypeScript di dalam folder pages. Nama file akan menjadi URL halaman tersebut. Misalnya, pages/about.js akan menjadi /about.
Apa itu dynamic routing di Next.js|Dynamic routing di Next.js memungkinkan Anda membuat rute dinamis menggunakan tanda kurung kotak di nama file dalam folder pages. Contohnya, pages/posts/[id].js akan menciptakan rute dinamis yang dapat diakses dengan URL seperti /posts/1, /posts/2, dll.
uhuuuyyy|cihuyyyyy.
Bagaimana cara menggunakan API Routes di Next.js|API Routes di Next.js memungkinkan Anda membuat endpoint API dalam aplikasi Anda. Anda dapat membuat file JavaScript atau TypeScript di dalam folder pages/api. Misalnya, pages/api/hello.js akan membuat endpoint /api/hello yang bisa diakses dengan HTTP GET request.
minta akreditasi|Untuk meminta akreditasi, Anda harus mengirimkan aplikasi ke badan akreditasi yang relevan. Aplikasi ini harus berisi informasi tentang organisasi Anda, termasuk tujuan, struktur, dan program yang tersedia. Anda juga harus menyertakan dokumen lain yang relevan, seperti laporan keuangan, laporan audit, dan laporan evaluasi. Setelah aplikasi diajukan, badan akreditasi akan meninjau dokumen dan melakukan audit lapangan untuk memastikan bahwa organisasi Anda memenuhi standar akreditasi.
Apa itu Image Optimization di Next.js|Image Optimization di Next.js menyediakan komponen next/image yang otomatis mengoptimalkan gambar untuk kinerja yang lebih baik, termasuk loading yang lebih cepat dan pengaturan ukuran gambar secara responsif.
Apa itu getStaticProps dan kapan sebaiknya digunakan|getStaticProps adalah fungsi Next.js yang digunakan untuk mengambil data pada build time untuk halaman yang menggunakan Static Site Generation (SSG). Fungsi ini sebaiknya digunakan ketika data tidak sering berubah dan Anda ingin halaman di-render dengan cepat dari konten statis.
malesin ah|apasih kamu pemalas.
kenapa batu itu keras|karna kalau lembek bubur.
gajelas|emang kamu gajelas.
lagi error kayak nya miss|konfigurasi\n\nKesalahan konfigurasi biasanya disebabkan oleh kesalahan dalam pengaturan sistem atau aplikasi. Untuk memperbaiki masalah ini, Anda harus memeriksa semua pengaturan yang terkait dengan sistem atau aplikasi yang bermasalah. Jika Anda tidak yakin tentang bagaimana cara mengkonfigurasi sistem atau aplikasi, Anda harus mencari bantuan dari ahli teknis yang berpengalaman.
Apa itu MQTT?|MQTT adalah protokol jaringan yang digunakan untuk komunikasi machine-to-machine (M2M) dan Internet of Things (IoT).
Apa singkatan dari MQTT?|MQTT singkatan dari Message Queuing Telemetry Transport.
Mengapa MQTT digunakan di IoT?|MQTT digunakan di IoT karena protokol ini ringan, mudah diimplementasikan, dan efisien untuk perangkat dengan sumber daya terbatas.
Bagaimana MQTT bekerja?|MQTT bekerja dengan model publish/subscribe, di mana perangkat dapat berlangganan atau menerbitkan pesan ke topik tertentu di broker MQTT.
Apa itu broker MQTT?|Broker MQTT adalah server yang bertanggung jawab untuk menerima semua pesan, memfilter, dan meneruskannya ke klien yang sesuai.
Apa perbedaan MQTT dan HTTP?|MQTT lebih ringan dan efisien dibandingkan HTTP, serta menggunakan lebih sedikit bandwidth, menjadikannya lebih cocok untuk perangkat IoT.
Apa fungsi dari QoS dalam MQTT?|QoS (Quality of Service) dalam MQTT menentukan tingkat jaminan pengiriman pesan antara penerbit dan penerima.
Apa itu topik dalam MQTT?|Topik dalam MQTT adalah saluran virtual yang digunakan untuk mengategorikan pesan yang diterbitkan oleh klien.
Apa itu Vercel?|Vercel adalah platform yang memungkinkan pengembang untuk membuat, membangun, dan mengelola aplikasi web yang sangat cepat dan efisien.
Apa fungsi utama Vercel?|Fungsi utama Vercel adalah untuk mempermudah deployment aplikasi web dengan menyediakan infrastruktur yang skalabel dan performa tinggi.
Bagaimana cara deploy aplikasi ke Vercel?|Anda bisa deploy aplikasi ke Vercel dengan menghubungkan repositori GitHub atau GitLab ke Vercel, kemudian melakukan commit dan push kode Anda.
Apakah Vercel mendukung serverless functions?|Ya, Vercel mendukung serverless functions yang memungkinkan Anda menjalankan kode backend tanpa perlu mengelola server.
Platform apa saja yang didukung oleh Vercel?|Vercel mendukung berbagai platform seperti Next.js, React, Vue.js, dan banyak lagi.
Bagaimana cara menggunakan custom domain di Vercel?|Anda bisa menambahkan custom domain melalui dashboard Vercel dan mengikuti langkah-langkah verifikasi yang diberikan.
Apakah Vercel gratis?|Vercel menawarkan paket gratis dengan fitur dasar, namun juga memiliki paket berbayar dengan fitur tambahan untuk kebutuhan yang lebih kompleks.
Apakah Vercel cocok untuk proyek skala besar?|Ya, Vercel cocok untuk proyek skala besar karena menyediakan infrastruktur yang dapat diskalakan dan performa tinggi.
Bagaimana cara mengatur environment variables di Vercel?|Anda bisa mengatur environment variables melalui dashboard Vercel di bagian "Settings" pada proyek Anda.
Apakah Vercel memiliki integrasi dengan alat CI/CD?|Ya, Vercel memiliki integrasi dengan alat CI/CD seperti GitHub Actions, GitLab CI, dan Bitbucket Pipelines untuk otomatisasi proses deployment.
kadang gajelas kamu|kamu juga sama.
assalammualaikumsaya buka untuk perwalian ya|Selamat datang di Perwalian. Kami di sini untuk membantu Anda dalam membuat keputusan yang tepat tentang pendidikan Anda. Kami akan membantu Anda menemukan program yang tepat untuk Anda dan membantu Anda mengatur jadwal Anda. Kami juga akan membantu Anda menemukan bantuan finansial yang tersedia untuk membantu Anda mencapai tujuan pendidikan Anda.\n\nKami berharap Anda dapat menikmati proses perwalian dan mendapatkan manfaat dari layanan kami. Jika Anda memiliki pertanyaan atau memerlukan bantuan lebih lanjut, jangan ragu untuk menghubungi kami.\n\nTerima kasih.
assalammualaikumsaya buka perwalian menggunakan ya|Walaikumsalam. Selamat datang di Perwalian.Kami di sini untuk membantu Anda membuat pilihan yang tepat dalam memilih program pendidikan yang tepat untuk Anda. Silakan berbicara dengan kami untuk informasi lebih lanjut tentang program pendidikan yang tersedia dan bagaimana kami dapat membantu Anda. Terima kasih.
ngadat|Kami menyambut baik kedatangan Anda. Kami berharap Anda dapat menikmati waktu Anda bersama kami. Kami akan melakukan yang terbaik untuk memastikan Anda mendapatkan pengalaman yang menyenangkan.
apasih perwalian|Perwalian adalah proses pengawasan dan pengarahan yang dilakukan oleh orang tua atau wali terhadap anak mereka. Proses ini bertujuan untuk memastikan bahwa anak-anak mereka mendapatkan pendidikan yang tepat dan berkualitas.
kenapa rumput warnanya hijau|karna kamu bau.
apa itu docker|Docker adalah platform perangkat lunak yang memungkinkan Anda untuk membangun, menguji, dan mendistribusikan aplikasi dengan cepat. Docker mengemas perangkat lunak ke dalam unit standar yang disebut kontainer yang memiliki semua yang diperlukan aplikasi untuk berjalan, termasuk perpustakaan, sistem alat, kode, dan runtime.
kayanya gangguan ya gbisa input absen wkwkw|Maaf, kami tidak dapat membantu Anda dengan masalah gangguan input absen. Anda harus menghubungi pihak yang bertanggung jawab untuk memecahkan masalah ini.
bagaimana cara install docker|Untuk menginstal Docker di Windows, Anda bisa mendownload Docker Desktop dari situs resmi Docker. Setelah file diunduh, buka installer dan ikuti petunjuk yang diberikan.
apa kegunaan docker|Docker digunakan untuk membuat, menguji, dan mendistribusikan aplikasi dengan lebih cepat dan mudah. Dengan Docker, Anda dapat memastikan bahwa aplikasi akan berjalan pada setiap mesin tanpa perlu khawatir tentang persyaratan sistem tertentu.
apa itu docker image|Docker image adalah template read-only yang berisi instruksi untuk membuat Docker container. Image biasanya berisi aplikasi dan semua dependensi yang dibutuhkan aplikasi tersebut.
apakah kang ari ganteng|Ini adalah pertanyaan subjektif yang tidak dapat dijawab dengan benar atau salah. Jawaban tergantung pada pandangan masing-masing orang.
kamu ganteng|Terima kasih, tapi saya lebih suka disebut cantik.
apa itu docker container|Docker container adalah unit standar perangkat lunak yang mengemas kode dan semua dependensinya sehingga aplikasi berjalan dengan cepat dan andal dari satu lingkungan komputasi ke lingkungan komputasi lainnya.
bagaimana cara membuat docker image|Anda bisa membuat Docker image dengan membuat Dockerfile, sebuah file teks yang berisi instruksi tentang bagaimana membangun image Anda. Setelah Dockerfile dibuat, Anda bisa menjalankan perintah 'docker build' untuk membuat image.
bagaimana cara menjalankan docker container|Untuk menjalankan Docker container, Anda bisa menggunakan perintah 'docker run', diikuti dengan nama image yang ingin Anda jalankan.
apa itu docker hub|Docker Hub adalah layanan cloud yang memungkinkan Anda untuk berbagi Docker images dengan orang lain. Anda bisa meng-upload images Anda sendiri, atau mendownload images yang dibuat dan dibagikan oleh orang lain.
bagaimana cara push docker image ke docker hub|Untuk push Docker image ke Docker Hub, Anda perlu login ke Docker Hub menggunakan perintah 'docker login'. Setelah itu, Anda bisa menggunakan perintah 'docker push' untuk meng-upload image Anda.
apa itu docker compose|Docker Compose adalah alat yang digunakan untuk mendefinisikan dan menjalankan aplikasi Docker multi-container. Dengan Docker Compose, Anda bisa menggunakan file YAML untuk mengkonfigurasi layanan aplikasi Anda dan kemudian membuat dan memulai semua layanan tersebut dengan satu perintah.
apa itu Dockerfile|Dockerfile adalah file teks yang berisi serangkaian instruksi untuk membuat Docker image. Instruksi ini mencakup pengaturan lingkungan, penambahan file, dan konfigurasi lainnya yang diperlukan untuk menjalankan aplikasi dalam Docker container.
kapan bimbingan|kamu siapa kok nanya ke saya sih.
dicoba dulu dul nanti pas keyword nya masuk baru kirim keyword di grup|Kami menyarankan Anda untuk mencoba keyword tersebut di mesin pencari seperti Google atau Bing terlebih dahulu. Setelah Anda mengetahui hasil pencarian, Anda dapat membagikan keyword tersebut di grup.
Apa itu Fly.io|Fly.io adalah platform hosting aplikasi yang memungkinkan developer menjalankan aplikasi di berbagai lokasi di seluruh dunia.
Bagaimana cara mendaftar di Fly.io|Anda dapat mendaftar di Fly.io dengan mengunjungi situs web mereka dan mengikuti proses pendaftaran.
Apakah Fly.io mendukung Docker|Ya, Fly.io mendukung aplikasi berbasis Docker.
Bagaimana cara deploy aplikasi di Fly.io|Anda bisa deploy aplikasi di Fly.io dengan menggunakan Fly CLI dan mengikuti panduan deploy di dokumentasi Fly.io.
Apakah Fly.io mendukung scaling otomatis|Ya, Fly.io mendukung scaling otomatis berdasarkan kebutuhan aplikasi.
