indonesia|Indonesia is a Southeast Asian country located between the Indian and Pacific Oceans. It is the world's largest island country, with more than 17,000 islands. Indonesia is home to a diverse range of cultures, languages, and religions, and is the world's fourth most populous country. The country is known for its rich biodiversity, with tropical rainforests, mangroves, and coral reefs. Indonesia is also a major producer of coffee, palm oil, and other agricultural products. Tourism is a major industry in Indonesia, with its many beaches, volcanoes, and cultural attractions.
pake bahasa indonesia|Halo, bagaimana kabarmu?
makan apa hari ini|Hari ini, saya akan makan nasi goreng dan ayam goreng.
menu buka hari ini|- Nasi Goreng\n- Mie Goreng\n- Ayam Goreng\n- Sate Ayam\n- Bakso\n- Soto Ayam\n- Gado-Gado\n- Sayur Asem\n- Rawon\n- Nasi Uduk
resep kolak candil|Bahan-bahan:\n\n- 2 cangkir gula pasir\n- 2 cangkir air\n- 2 cangkir santan\n- 2 buah pisang, potong-potong\n- 2 buah kolang-kaling, potong-potong\n- 2 buah kacang mete, potong-potong\n- 2 buah kismis\n- 2 buah kurma\n- 2 buah cengkeh\n- 2 batang kayu manis\n- 2 lembar daun salam\n- 2 lembar daun pandan\n\nCara Membuat:\n\n1. Rebus gula pasir dan air hingga mendidih.\n\n2. Masukkan santan, pisang, kolang-kaling, kacang mete, kismis, kurma, cengkeh, kayu manis, daun salam, dan daun pandan.\n\n3. Masak hingga semua bahan-bahan meleleh dan kuah mengental.\n\n4. Angkat dan sajikan panas-panas.
kolak candil |Kolak candil adalah makanan tradisional Indonesia yang terbuat dari santan, gula merah, dan biji labu. Makanan ini biasanya disajikan pada saat hari raya atau acara-acara lainnya. Kolak candil memiliki rasa manis dan lembut, dan dapat disajikan dengan berbagai topping seperti kacang, keju, dan lainnya.
resep kolak candil |Bahan-bahan:\n\n- 2 buah labu siam, kupas dan potong-potong\n- 2 buah pisang ambon, kupas dan potong-potong\n- 2 buah kolang-kaling, kupas dan potong-potong\n- 2 buah kacang hijau, kupas dan potong-potong\n- 2 buah kacang merah, kupas dan potong-potong\n- 2 buah kacang tanah, kupas dan potong-potong\n- 2 buah kacang mete, kupas dan potong-potong\n- 2 buah kacang mede, kupas dan potong-potong\n- 2 buah kacang gajah, kupas dan potong-potong\n- 2 buah kacang panjang, kupas dan potong-potong\n- 2 buah kacang polong, kupas dan potong-potong\n- 2 buah kacang kenari, kupas dan potong-potong\n- 2 buah kacang buncis, kupas dan potong-potong\n- 2 buah kacang hijau, kupas dan potong-potong\n- 2 buah kacang merah, kupas dan potong-potong\n- 2 buah kacang tanah, kupas dan potong-potong\n- 2 buah kacang mete, kupas dan potong-potong\n- 2 buah kacang mede, kupas dan potong-potong\n- 2 buah kacang gajah, kupas dan potong-potong\n- 2 buah kacang panjang, kupas dan potong-potong\n- 2 buah kacang polong, kupas dan potong-potong\n- 2 buah kacang kenari, kupas dan potong-potong\n- 2 buah kacang buncis, kupas dan potong-potong\n- 2 buah kacang hijau, kupas dan potong-potong\n- 2 buah kacang merah, kupas dan potong-potong\n- 2 buah kacang tanah, kupas dan potong-potong\n- 2 buah kacang mete, kupas dan potong-potong\n- 2 buah kacang mede, kupas dan potong-potong\n- 2 buah kacang gajah, kupas dan potong-potong\n- 2 buah kacang panjang, kupas dan potong-potong\n- 2 buah kacang polong, kupas dan potong-potong\n- 2 buah kacang kenari, kupas dan potong-potong\n- 2 buah kacang buncis, kupas dan potong-potong\n- 2 buah kacang hijau, kupas dan potong-potong\n- 2 buah kacang merah, kupas dan potong-potong\n- 2 buah kacang tanah, kupas dan potong-potong\n- 2 buah kacang mete, kupas dan potong-potong\n- 2 buah kacang mede, kupas dan potong-potong\n- 2 buah kacang gajah, kupas dan potong-potong\n- 2 buah kacang panjang, kupas dan potong-potong\n- 2 buah kacang polong, kupas dan potong-potong\n- 2 buah kacang kenari, kupas dan potong-potong\n- 2 buah kacang buncis, kupas dan potong-potong\n- 2 buah kacang hijau, kupas dan potong-potong\n- 2 buah kacang merah, kupas dan potong-potong\n- 2 buah kacang tanah, kupas dan potong-potong\n- 2 buah kacang mete, kupas dan potong-potong\n- 2 buah kacang mede, kupas dan potong-potong\n- 2 buah kacang gajah, kupas dan potong-potong\n- 2 buah kacang panjang, kupas dan potong-potong\n- 2 buah kacang polong, kupas dan potong-potong\n- 2 buah kacang kenari, kupas dan potong-potong\n- 2 buah kacang buncis, kupas dan potong-potong\n- 2 buah kacang hijau, kupas dan potong-potong\n- 2 buah kacang merah, kupas dan potong-potong\n- 2 buah kacang tanah, kupas dan potong-potong\n- 2 buah kacang mete, kupas dan potong-potong\n- 2 buah kacang mede, kupas dan potong-potong\n- 2 buah kacang gajah, kupas dan potong-potong\n- 2 buah kacang panjang, kupas dan potong-potong\n- 2 buah kacang polong, kupas dan potong-potong\n- 2 buah kacang kenari, kupas dan potong-potong\n- 2 buah kacang buncis, kupas dan potong-potong\n- 2 buah kacang hijau, kupas dan potong-potong\n- 2 buah kacang merah, kupas dan potong-potong\n- 2 buah kacang tanah, kupas dan potong-potong\n- 2 buah kacang mete, kupas dan potong-potong\n- 2 buah kacang mede, kupas dan potong-potong\n- 2 buah kacang gajah, kupas dan potong-potong\n- 2 buah kacang panjang, kupas dan potong-potong\n- 2 buah kacang polong, kupas dan potong-potong\n- 2 buah kacang kenari, kupas dan potong-potong\n- 2 buah kacang buncis, kupas dan potong-potong\n- 2 buah kacang hijau, kupas dan potong-potong\n- 2 buah kacang merah, kupas dan potong-potong\n- 2 buah kacang tanah, kupas dan potong-potong\n- 2 buah kacang mete, kupas dan potong-potong\n- 2 buah kacang mede, kupas dan potong-potong\n- 2 buah kacang gajah, kupas dan potong-potong\n- 2 buah kacang panjang, kupas dan potong-potong\n- 2 buah kacang polong, kupas dan potong-potong\n- 2 buah kacang kenari, kupas dan potong-potong\n- 2 buah kacang buncis, kupas dan potong-potong\n- 2 buah kacang hijau, kupas dan potong-potong\n- 2 buah kacang merah, kupas dan potong-potong\n- 2 buah kacang tanah, kupas dan potong-potong\n- 2 buah kacang mete, kupas dan potong-potong\n- 2 buah kacang mede, kupas dan potong-potong\n- 2 buah kacang gajah, kupas dan potong-potong\n- 2 buah kacang panjang, kupas dan potong-potong\n- 2 buah kacang polong, kupas dan potong-potong\n- 2 buah kacang kenari, kupas dan potong-potong\n- 2 buah kacang buncis, kupas dan potong-potong\n- 2 buah kacang hijau, kupas dan potong-potong\n- 2 buah kacang merah, kupas dan potong-potong\n- 2 buah kacang tanah, kupas dan potong-potong\n- 2 buah kacang mete, kupas dan potong-potong\n- 2 buah kacang mede, kupas dan potong-potong\n- 2 buah kacang gajah, kupas dan potong-potong\n- 2 buah kacang panjang, kupas dan potong-potong\n- 2 buah kacang polong, kupas dan potong-potong\n- 2 buah kacang kenari, kupas dan potong-potong\n- 2 buah kacang buncis, kupas dan potong-potong\n- 2 buah kacang hijau, kupas dan potong-potong\n- 2 buah kacang merah, kupas dan potong-potong\n- 2 buah kacang tanah, kupas dan potong-potong\n- 2 buah kacang mete, kupas dan potong-potong\n- 2 buah kacang mede, kupas dan potong-potong\n- 2 buah kacang gajah, kupas dan potong-potong\n- 2 buah kacang panjang, kupas dan potong-potong\n- 2 buah kacang polong, kupas dan potong-potong\n- 2 buah kacang kenari, kupas dan potong-potong\n- 2 buah kacang buncis, kupas dan potong-potong\n- 2 buah kacang hijau, kupas dan potong-potong\n- 2 buah kacang merah, kupas dan potong-potong\n- 2 buah kacang tanah, kupas dan potong-potong\n- 2 buah kacang mete, kupas dan potong-potong\n- 2 buah kacang mede, kupas dan potong-potong\n- 2 buah kacang gajah, kupas dan potong-potong\n- 2 buah kacang panjang, kupas dan potong-potong\n- 2 buah kacang polong, kupas dan potong-potong\n- 2 buah kacang kenari, kupas dan potong-potong\n- 2 buah kacang buncis, kupas dan potong-potong\n- 2 buah kacang hijau, kupas dan potong-potong\n- 2 buah kacang merah, kupas dan potong-potong\n- 2 buah kacang tanah, kupas dan potong-potong\n- 2 buah kacang mete, kupas dan potong-potong\n- 2 buah kacang mede, kupas dan potong-potong\n- 2 buah kacang gajah, kupas dan potong-potong\n- 2 buah kacang panjang, kupas dan potong-potong\n- 2 buah kacang polong, kupas dan potong-potong\n- 2 buah kacang kenari, kupas dan potong-potong\n- 2 buah kacang buncis, kupas dan potong-potong\n- 2 buah kacang hijau, kupas dan potong-potong\n- 2 buah kacang merah, kupas dan potong-potong\n- 2 buah kacang tanah, kupas dan potong-potong\n- 2 buah kacang mete, kupas dan potong-potong\n- 2 buah kacang mede, kupas dan potong-potong\n- 2 buah kacang gajah, kupas dan potong-potong\n- 2 buah kacang panjang, kupas dan potong-potong\n- 2 buah kacang polong, kupas dan potong-potong\n- 2 buah kacang kenari, kupas dan potong-potong\n- 2 buah kacang buncis, kupas dan potong-potong\n- 2 buah kacang hijau, kupas dan potong-potong\n- 2 buah kacang merah, kupas dan potong-potong\n- 2 buah kacang tanah, kupas dan potong-potong\n- 2 buah kacang mete, kupas dan potong-potong\n- 2 buah kacang mede, kupas dan potong-potong\n- 2 buah kacang gajah, kupas dan potong-potong\n- 2 buah kacang panjang, kupas dan potong-potong\n- 2 buah kacang polong, kupas dan potong-potong\n- 2 buah kacang kenari, kupas dan potong-potong\n- 2 buah kacang buncis, kupas dan potong-potong\n- 2 buah kacang hijau, kupas dan potong-potong\n- 2 buah kacang merah, kupas dan potong-potong\n- 2 buah kacang tanah, kupas dan potong-potong\n- 2 buah kacang mete, kupas dan potong-potong\n- 2 buah kacang mede, kupas dan potong-potong\n- 2 buah kacang gajah, kupas dan potong-potong\n- 2 buah kacang panjang, kupas dan potong-potong\n- 2 buah kacang polong, kupas dan potong-potong\n- 2 buah kacang kenari, kupas dan potong-potong\n- 2 buah kacang buncis, kupas dan potong-potong\n- 2 buah kacang hijau, kupas dan potong-potong\n- 2 buah kacang merah, kupas dan potong-potong\n- 2 buah kacang tanah, kupas dan potong-potong\n- 2 buah kacang mete, kupas dan potong-potong\n- 2 buah kacang mede, kupas dan potong-potong\n- 2 buah kacang gajah, kupas dan potong-potong\n- 2 buah kacang panjang, kupas dan potong-potong\n- 2 buah kacang polong, kupas dan potong-potong\n- 2 buah kacang kenari, kupas dan potong-potong\n- 2 buah kacang buncis, kupas dan potong-potong\n- 2 buah kacang hijau, kupas dan potong-potong\n- 2 buah kacang merah, kupas dan potong-potong\n- 2 buah kacang tanah, kupas dan potong-potong\n- 2 buah kacang mete, kupas dan potong-potong\n- 2 buah kacang mede, kupas dan potong-potong\n- 2 buah kacang gajah, kupas dan potong-potong\n- 2 buah kacang panjang, kupas dan potong-potong\n- 2 buah kacang polong, kupas dan potong-potong\n- 2 buah kacang kenari, kupas dan potong-potong\n- 2 buah kacang buncis, kupas dan potong-potong\n- 2 buah kacang hijau, kupas dan potong-potong\n- 2 buah kacang merah, kupas dan potong-potong\n- 2 buah kacang tanah, kupas dan potong-potong\n- 2 buah kacang mete, kupas dan potong-potong\n- 2 buah kacang mede, kupas dan potong-potong\n- 2 buah kacang gajah, kupas dan potong-potong\n- 2 buah kacang panjang, kupas dan potong-potong\n- 2 buah kacang polong, kupas dan potong-potong\n- 2 buah kacang kenari, kupas dan potong-potong\n- 2 buah kacang buncis, kupas dan potong-potong\n- 2 buah kacang hijau, kupas dan potong-potong\n- 2 buah kacang merah, kupas dan potong-potong\n- 2 buah kacang tanah, kupas dan potong-potong\n- 2 buah kacang mete, kupas dan
Bagaimana cara menambahkan anotasi pada grafik?|Untuk menambahkan anotasi pada grafik, Anda dapat menggunakan fungsi plt.annotate().
Apa itu form group di Bootstrap|Form group adalah kelas Bootstrap yang digunakan untuk merapikan tampilan elemen form dan pesan bantuan.
annida mahfiroh 4194038 i hadir|Halo Nida,\n\nTerima kasih telah hadir. Semoga Anda mendapatkan manfaat dari kehadiran Anda.
reksa almeida firmansyah 4194062 i hadir|Terima kasih telah hadir.
haiqal abdillah 4194050 hadir|Terima kasih atas kehadiran anda. Semoga anda dapat mengambil manfaat dari kelas yang anda hadiri.
hari ini libur apaan|Hari ini adalah hari Sabtu, jadi tidak ada libur khusus.
gresya hutabarat 4194049 hadir|Maaf, saya tidak mengerti pertanyaan Anda. Silakan dijelaskan lebih lanjut.
fransnico sihombing 4194047 hadir|Halo Fransnico Sihombing, terima kasih telah hadir. Kami berharap Anda dapat menikmati waktu Anda di sini dan menikmati pengalaman yang menyenangkan. Jika ada pertanyaan atau bantuan yang Anda butuhkan, jangan ragu untuk menghubungi kami. Terima kasih.
rahmala sari 4194060 hadir|Maaf, saya tidak dapat menjawab pertanyaan Anda. Mohon maaf atas ketidaknyamanan ini.
hibatul fadli dzil ikram 4184052 hadir|Terima kasih atas kehadiran Saudara Fadli Dzil Ikram. Semoga kehadiran Saudara dapat memberikan manfaat bagi semua.
dody siahaan 4194046 hadir|Halo Dody,\n\nSelamat datang di sini. Kami senang bisa berbicara dengan Anda. Apa yang bisa kami bantu?
dhafin 4194043 hadir|Saya hadir.
aef saepurohim 4194036 hadir|Hai saepurohim,\n\nSelamat datang di acara yang kami adakan. Kami sangat senang bisa menghadirkan Anda di sini. Kami berharap Anda dapat menikmati acara ini dan berbagi pengalaman Anda dengan kami. Terima kasih atas kunjungan Anda.
apa itu bukupedia|bukupedia adalah penerbit buku
selamat siang pak punten pak saya ingin bertanya untuk proposal kami apakah sudah memenuhi  apabila sudah memenuhi apakah kami sudah bisa untuk mengupload proposal kami ke untuk pengumpulan proposal terima kasih pak,\n\nSelamat siang|Terima kasih atas pertanyaan Anda. Untuk mengetahui apakah proposal Anda sudah memenuhi syarat, Anda harus mengikuti petunjuk yang diberikan oleh. Jika Anda telah memenuhi semua persyaratan, Anda dapat mengupload proposal Anda ke untuk pengumpulan proposal. Semoga membantu.
program C++ yang membaca matriks ukuran 𝑛 × 𝑚 dan menghitung serta mencetak jumlah maksimum dari submatriks mana pun di dalam matriks tersebut|#include <iostream>\n#include <string>\n#include <vector>\n#include <algorithm>\n#include <cmath>\n#include <sstream>\n#include <map>\n#include <set>\n#include <iomanip>\n\nusing namespace std;\n\n#define sz(a) int((a).size())\n#define pb push_back\n#define all(c) (c).begin(), (c).end()\n#define tr(c,i) for(typeof((c).begin()) i = (c).begin(); i!=(c).end(); i++\n#define present(c,x) ((c).find(x)!=(c).end())\n#define cpresent(c,x) (find(all(c),x) != (c).end()\n\ntypedef vector<int> vi;\ntypedef vector<vi> vvi;\ntypedef pair<int, int> ii;\n\nint main(){\n\n    int n,m;\n    cin>>n>>m;\n    int arr[n][m];\n    for(int i=0;i<n;i++){\n        for(int j=0;j<m;j++){\n            cin>>arr[i][j];\n        }\n    }\n    int max_sum=0;\n    int sum=0;\n    for(int i=0;i<n;i++){\n        for(int j=0;j<m;j++){\n            for(int k=i;k<n;k++){\n                for(int l=j;l<m;l++){\n                    sum=0;\n                    for(int a=i;a<=k;a++){\n                        for(int b=j;b<=l;b++){\n                            sum+=arr[a][b];\n                        }\n                    }\n                    if(sum>max_sum)\n                        max_sum=sum;\n                }\n            }\n        }\n    }\n    cout<<max_sum<<endl;\n    return 0;\n}
Apakah orang dengan tubuh kurus lebih sehat daripada orang dengan tubuh yang lebih berat?|Tidak benar bahwa orang dengan tubuh kurus lebih sehat daripada orang dengan tubuh yang lebih berat. Ada banyak faktor yang berkontribusi pada kesehatan seseorang, termasuk nutrisi, olahraga, genetika, dan gaya hidup. Tubuh kurus bisa sama sehatnya dengan tubuh yang lebih berat, tergantung pada gaya hidup orang tersebut. Seseorang dengan tubuh kurus bisa sama sehatnya dengan seseorang dengan tubuh yang lebih berat jika mereka memiliki gaya hidup yang sehat, seperti pola makan yang sehat, cukup berolahraga, dan cukup istirahat.
tempat makan terdekat dari bandung|Berikut adalah beberapa tempat makan terdekat dari Bandung: \n\n1. Warung Makan Sederhana \n2. Warung Makan Sari Rasa \n3. Warung Makan Sari Laut \n4. Warung Makan Sari Kuring \n5. Warung Makan Sari Bumbu \n6. Warung Makan Sari Kebon \n7. Warung Makan Sari Kebon Raya \n8. Warung Makan Sari Kebon Jati \n9. Warung Makan Sari Kebon Jati Baru \n10. Warung Makan Sari Kebon Jati Lama
update judul tipe bimbingan p1 tahun id 20222 membuat package dengan bahasa pemograman go pada google drive dan google docs,\n\nMembuat Package dengan Bahasa Pemrograman Go di Google Drive dan Google Docs.|Judul tipe bimbingan P1 untuk tahun ID 20222 telah diperbarui menjadi: Membuat Package dengan Bahasa Pemrograman Go di Google Drive dan Google Docs.
update judul tipe bimbingan p1 tahun id 20222 membuat package dengan bahasa pemograman go pada google drive dan google docs,\n\nMembuat Package dengan Bahasa Pemrograman Go di Google Drive dan Google Docs|Judul tipe bimbingan P1 untuk tahun ID 20222 telah diperbarui menjadi: Membuat Package dengan Bahasa Pemrograman Go di Google Drive dan Google Docs.
minta kode dosen dong|Maaf, saya tidak bisa memberikan kode dosen. Silakan hubungi pihak terkait atau dosen yang bersangkutan secara langsung untuk mendapatkan informasi tersebut.	
minta link bimbingan kemarin|untuk link bimbingan kemarin boleh diminta ke i,qbal.maulana@binus.edu
izin pak kalau kata bu novi paling telat besok pak tapi katanya kalau bisa hari ini karena besok maintenance|Maaf, saya tidak bisa memberikan jawaban yang pasti karena saya tidak tahu apa yang Anda maksud dengan pak. Namun, jika Anda bertanya tentang waktu pemeliharaan, maka jawabannya adalah tergantung pada jadwal pemeliharaan yang telah ditentukan.
minta link website bukupedia|ini link nya https://www.bukupedia.co.id/
apa itu perwalian|Perwalian adalah proses pengawasan dan pengelolaan pendidikan siswa di sekolah. Proses ini melibatkan orang tua, guru, dan pihak sekolah. Perwalian bertujuan untuk memastikan bahwa siswa mendapatkan pendidikan yang tepat dan berkualitas. Proses ini juga membantu siswa untuk mencapai tujuan akademik mereka.\n\nPerwalian meliputi berbagai aspek pendidikan siswa, termasuk pemilihan mata pelajaran, pemantauan kemajuan akademik, pengelolaan masalah disiplin, dan pengembangan keterampilan sosial. Proses ini juga melibatkan orang tua dalam membantu siswa mencapai tujuan akademik mereka.\n\nPerwalian juga membantu siswa untuk mengembangkan keterampilan sosial mereka. Proses ini melibatkan orang tua dan guru untuk membantu siswa mengembangkan keterampilan sosial yang diperlukan untuk berhasil di sekolah dan di kehidupan. Proses ini juga membantu siswa untuk mengembangkan keterampilan berpikir kritis dan keterampilan komunikasi yang diperlukan untuk berhasil di sekolah dan di kehidupan.
are you still there|Yes, I'm still here.
what relation public key infrastructure and digital signature|Public Key Infrastructure (PKI) is a system of digital certificates, public and private keys, and other authentication mechanisms that are used to verify the identity of a user or device and to secure data in digital transactions. Digital signatures are a type of authentication mechanism used in PKI that uses a combination of public and private keys to verify the identity of the sender and the integrity of the data being sent. Digital signatures are used to ensure that the data has not been tampered with and that the sender is who they say they are.
lah ngape|Ang pag-aalaga ng ape ay isang mahalagang aspeto ng pag-aalaga ng hayop. Ang mga ape ay may kahalagahan sa kapaligiran at sa mga ekosistema. Ang pag-aalaga ng ape ay nangangailangan ng pag-iingat, pag-aalaga, at pag-iingat sa kalusugan. Ang mga ape ay kailangang magkaroon ng isang malusog na diyeta, isang malinis na kapaligiran, at isang mahusay na pag-aalaga sa kalusugan. Ang mga ape ay kailangang magkaroon ng isang mahusay na pag-aalaga sa kalusugan, kabilang ang pag-iwas sa mga sakit at pag-iwas sa mga parasito. Ang mga ape ay kailangang magkaroon ng isang mahusay na pag-aalaga sa kalusugan, kabilang ang pag-iwas sa mga sakit at pag-iwas sa mga parasito. Ang mga ape ay kailangang magkaroon ng isang mahusay na pag-aalaga sa kalusugan, kabilang ang pag-iwas sa mga sakit at pag-iwas sa mga parasito. Ang mga ape ay kailangang magkaroon ng isang mahusay na pag-aalaga sa kalusugan, kabilang ang pag-iwas sa mga sakit at pag-iwas sa mga parasito.
bagaimana cara untuk konfirmasi judul pak|Anda dapat menghubungi penerbit buku untuk mengkonfirmasi judul. Anda juga dapat mencari informasi tentang judul di internet.
Apa yang membuat Tutuengo menonjol di antara kota dan komune lainnya di daerah tersebut|Tutuengo is a town and commune in the Cercle of Koutiala in the Sikasso Region of southern Mali. The commune covers an area of 545 square kilometers and includes the town and 28 villages. In the 2009 census it had a population of 28,845. The town of Tutuengo, the administrative centre (chef-lieu) of the commune, is 40km northeast of Koutiala.\n\n\nExternal links\n\n* Plan de Sécurité Alimentaire Commune Rurale de Tutuengo 2006-2010 (http://www.aec.msu.edu/fs2/mali_fd_strtgy/plans/sikasso/koutiala/psa_tutuengo.pdf). Commissariat à la Sécurité Alimentaire, République du Mali, USAID-Mali..\n\nCategory:Communes of Sikasso Region
tatang lagi pusing jangan panggil panggil|Jangan panggil tatang. Cobalah untuk menenangkan dia dengan berbicara dengannya dan menanyakan apa yang membuatnya pusing. Jika dia tidak bisa mengatasi masalahnya sendiri, cobalah untuk menyarankan agar dia berbicara dengan seorang profesional untuk mendapatkan bantuan.
ih sebentar pelan pelan dong|Tentu saja, dengan senang hati. Aku akan melakukannya dengan pelan dan lembut. Aku akan memainkan lagu yang menenangkan dan menyenangkan. Aku akan memainkan lagu yang akan membuatmu merasa rileks dan nyaman.
tatang lagi pusing jangan panggil panggil|Jangan panggil panggil tatang. Cobalah untuk menghibur dia dengan mengobrol atau mengajaknya untuk melakukan sesuatu yang menyenangkan. Jika ia masih terus pusing, cobalah untuk mengajaknya untuk berbicara dengan dokter atau ahli kesehatan mental.
tatang ada terus buat kamu kok|Tentu saja! Saya selalu siap untuk membantu Anda.
Bagaimana proses bimbingan dosen matakuliah di kampus ini? Apakah ada jadwal khusus atau metode komunikasi tertentu yang digunakan|Biasanya, proses bimbingan dosen matakuliah di kampus ini dilakukan melalui pertemuan tatap muka di kantor dosen atau melalui janji temu yang disesuaikan. Dosen juga dapat dihubungi melalui email atau platform pembelajaran daring. Setiap dosen memiliki kebijakan yang berbeda terkait jadwal dan metode komunikasi yang mereka preferensikan.
input absensi xh0n|Xh0n tidak hadir pada hari ini.
Apa yang dimaksud dengan algoritma|Algoritma adalah serangkaian langkah-langkah terstruktur untuk menyelesaikan masalah atau melakukan tugas tertentu. Ini adalah konsep dasar dalam pemrograman yang membantu pengembang menghasilkan solusi efisien dan efektif untuk berbagai permasalahan.
Apa format URL untuk halaman profil pengguna di VKontakte|Format URL untuk halaman profil pengguna di VKontakte adalah https://vk.com/id[user_id].
What is the difference between a regular and a special order|A regular order is an order placed with a retailer or wholesaler that is fulfilled according to their standard terms and conditions. A special order is an order placed with a retailer or wholesaler that requires special terms and conditions, such as a specific delivery date or a specific product. Special orders may also require additional fees or discounts.
Apa perbedaan antara perangkat lunak open source dan perangkat lunak propietary|Perangkat lunak open source memiliki kode sumber yang dapat diakses dan dimodifikasi oleh siapa pun, sementara perangkat lunak propietary memiliki kode sumber yang tidak tersedia untuk umum dan hanya dapat dimodifikasi oleh pemiliknya.
input absensi ym x7cg|Input absensi YM X7CG tidak dapat dilakukan karena YM X7CG merupakan nama sebuah grup di Yahoo Messenger.
Bagaimana peran perangkat lunak dalam meningkatkan efisiensi operasional suatu perusahaan|Perangkat lunak dapat membantu dalam otomatisasi tugas-tugas rutin, analisis data yang lebih cepat, serta memperbaiki komunikasi dan kolaborasi antar tim, yang semuanya berkontribusi pada peningkatan efisiensi operasional suatu perusahaan.
Bagaimana peran seorang dosen|1. Membimbing mahasiswa dalam menyelesaikan tugas-tugas akademik\n2. Memberikan bimbingan dan arahan kepada mahasiswa\n3. Memberikan konsultasi dan bimbingan kepada mahasiswa\n4. Memberikan materi kuliah dan menjelaskan materi kuliah\n5. Memberikan umpan balik dan evaluasi terhadap hasil karya mahasiswa\n6. Memberikan bimbingan dan arahan kepada mahasiswa dalam menyelesaikan tugas-tugas akademik\n7. Memberikan bimbingan dan arahan kepada mahasiswa dalam menyelesaikan tugas-tugas penelitian\n8. Memberikan bimbingan dan arahan kepada mahasiswa dalam menyelesaikan tugas-tugas pembelajaran\n9. Memberikan bimbingan dan arahan kepada mahasiswa dalam menyelesaikan tugas-tugas praktikum\n10. Memberikan bimbingan dan arahan kepada mahasiswa dalam menyelesaikan tugas-tugas magang\n11. Memberikan bimbingan dan arahan kepada mahasiswa dalam menyelesaikan tugas-tugas kelompok\n12. Memberikan bimbingan dan arahan kepada mahasiswa dalam menyelesaikan tugas-tugas skripsi\n13. Memberikan bimbingan dan arahan kepada mahasiswa dalam menyelesaikan tugas-tugas tesis\n14. Memberikan bimbingan dan arahan kepada mahasiswa dalam menyelesaikan tugas-tugas disertasi\n15. Memberikan bimbingan dan arahan kepada mahasiswa dalam menyelesaikan tugas-tugas lainnya\n16. Memberikan bimbingan dan arahan kepada mahasiswa dalam menyelesaikan tugas-tugas yang diberikan oleh dosen\n17. Memberikan bimbingan dan arahan kepada mahasiswa dalam menyelesaikan tugas-tugas yang diberikan oleh institusi\n18. Memberikan bimbingan dan arahan kepada mahasiswa dalam menyelesaikan tugas-tugas yang diberikan oleh pihak lain\n19. Memberikan bimbingan dan arahan kepada mahasiswa dalam menyelesaikan tugas-tugas yang diberikan oleh industri\n20. Memberikan bimbingan dan arahan kepada mahasiswa dalam menyelesaikan tugas-tugas yang diberikan oleh pemerintah
